{
  "functionSpecializations": [
    {
      "instanceId": "function.specialization.7144fbd75777c746113870e78d4be848e3aff7b96f8b315cba222f1c284cc65e",
      "reasons": [
        {
          "callerInstanceId": "function.Main.main",
          "source": {
            "startLine": 71,
            "file": "Main.hx",
            "startColumn": 22,
            "endLine": 71,
            "endColumn": 40
          }
        }
      ],
      "recursive": false,
      "specializationKey": "generic-function-v1(20:function.Main.choose2:3:i323:f64)",
      "arguments": [
        {
          "representation": "direct-primitive",
          "key": "i32",
          "parameter": "A",
          "displayName": "Int"
        },
        {
          "representation": "direct-primitive",
          "key": "f64",
          "parameter": "B",
          "displayName": "Float"
        }
      ],
      "cName": "hxc_Main_choose",
      "displayName": "choose<Int, Float>",
      "codeSize": {
        "definitionSha256": "26855709661e2845e922eb6d8208e5dd0b0574d07b646f0bfd83374c78acf2d8",
        "definitionBytes": 140,
        "metric": "strict-c11-utf8-function-definition-bytes",
        "irInstructions": 1,
        "irBlocks": 1
      },
      "baseFunctionId": "function.Main.choose",
      "semanticDigestSha256": "7144fbd75777c746113870e78d4be848e3aff7b96f8b315cba222f1c284cc65e"
    },
    {
      "instanceId": "function.specialization.bb037e38edd8d20445999f7284295e2d8052d82e8b4be7b0e14141054046b2e8",
      "reasons": [
        {
          "callerInstanceId": "function.specialization.c26381eaa7608af4f23df396b9ee4cfe9b312ced96722f149549fecf22f33b53",
          "source": {
            "startLine": 56,
            "file": "Main.hx",
            "startColumn": 10,
            "endLine": 56,
            "endColumn": 24
          }
        }
      ],
      "recursive": false,
      "specializationKey": "generic-function-v1(21:function.Main.forward1:3:i32)",
      "arguments": [
        {
          "representation": "direct-primitive",
          "key": "i32",
          "parameter": "T",
          "displayName": "Int"
        }
      ],
      "cName": "hxc_Main_forward",
      "displayName": "forward<Int>",
      "codeSize": {
        "definitionSha256": "2eeedd8f4eb363110903a7d3a4351302584f8793bdad555e60a48423d71e2271",
        "definitionBytes": 167,
        "metric": "strict-c11-utf8-function-definition-bytes",
        "irInstructions": 1,
        "irBlocks": 1
      },
      "baseFunctionId": "function.Main.forward",
      "semanticDigestSha256": "bb037e38edd8d20445999f7284295e2d8052d82e8b4be7b0e14141054046b2e8"
    },
    {
      "instanceId": "function.specialization.c26381eaa7608af4f23df396b9ee4cfe9b312ced96722f149549fecf22f33b53",
      "reasons": [
        {
          "callerInstanceId": "function.Main.main",
          "source": {
            "startLine": 75,
            "file": "Main.hx",
            "startColumn": 24,
            "endLine": 75,
            "endColumn": 62
          }
        }
      ],
      "recursive": false,
      "specializationKey": "generic-function-v1(21:function.Main.guarded1:3:i32)",
      "arguments": [
        {
          "representation": "direct-primitive",
          "key": "i32",
          "parameter": "T",
          "displayName": "Int"
        }
      ],
      "cName": "hxc_Main_guarded",
      "displayName": "guarded<Int>",
      "codeSize": {
        "definitionSha256": "4c36de937935da63cfa5d540628ea549e1a0100260a4ae1260dfe06ceb2e4cce",
        "definitionBytes": 253,
        "metric": "strict-c11-utf8-function-definition-bytes",
        "irInstructions": 2,
        "irBlocks": 3
      },
      "baseFunctionId": "function.Main.guarded",
      "semanticDigestSha256": "c26381eaa7608af4f23df396b9ee4cfe9b312ced96722f149549fecf22f33b53"
    },
    {
      "instanceId": "function.specialization.06e6a1db24dde2a490252e12571c9d513fe5d57a879210bda9159f23f7b9b446",
      "reasons": [
        {
          "callerInstanceId": "function.Main.main",
          "source": {
            "startLine": 91,
            "file": "Main.hx",
            "startColumn": 4,
            "endLine": 91,
            "endColumn": 24
          }
        }
      ],
      "recursive": false,
      "specializationKey": "generic-function-v1(22:function.Main.identity1:26:enum(10:GenericBox1:3:f64))",
      "arguments": [
        {
          "representation": "direct-enum",
          "key": "enum(10:GenericBox1:3:f64)",
          "parameter": "T",
          "displayName": "GenericBox<Float>"
        }
      ],
      "cName": "hxc_Main_identity_h9c14f7dfbb57",
      "displayName": "identity<GenericBox<Float>>",
      "codeSize": {
        "definitionSha256": "8a3a857cfd2c1c61134d2e3951d4b1ffee30de31a891f936817076e57004853e",
        "definitionBytes": 142,
        "metric": "strict-c11-utf8-function-definition-bytes",
        "irInstructions": 0,
        "irBlocks": 1
      },
      "baseFunctionId": "function.Main.identity",
      "semanticDigestSha256": "06e6a1db24dde2a490252e12571c9d513fe5d57a879210bda9159f23f7b9b446"
    },
    {
      "instanceId": "function.specialization.64f8f3d9b51363e9ae52690e11fc2086cd5d1b751bf3063ff9466bd78d9115e1",
      "reasons": [
        {
          "callerInstanceId": "function.Main.main",
          "source": {
            "startLine": 77,
            "file": "Main.hx",
            "startColumn": 34,
            "endLine": 77,
            "endColumn": 49
          }
        },
        {
          "callerInstanceId": "function.Main.main",
          "source": {
            "startLine": 90,
            "file": "Main.hx",
            "startColumn": 4,
            "endLine": 90,
            "endColumn": 22
          }
        },
        {
          "callerInstanceId": "function.Main.main",
          "source": {
            "startLine": 92,
            "file": "Main.hx",
            "startColumn": 4,
            "endLine": 92,
            "endColumn": 24
          }
        }
      ],
      "recursive": false,
      "specializationKey": "generic-function-v1(22:function.Main.identity1:26:enum(10:GenericBox1:3:i32))",
      "arguments": [
        {
          "representation": "direct-enum",
          "key": "enum(10:GenericBox1:3:i32)",
          "parameter": "T",
          "displayName": "GenericBox<Int>"
        }
      ],
      "cName": "hxc_Main_identity_h769597c6fca5",
      "displayName": "identity<GenericBox<Int>>",
      "codeSize": {
        "definitionSha256": "8e511e01bddb9f013d03de6b7c84954af5a3d4bacbe3163a226040b8e1b70801",
        "definitionBytes": 142,
        "metric": "strict-c11-utf8-function-definition-bytes",
        "irInstructions": 0,
        "irBlocks": 1
      },
      "baseFunctionId": "function.Main.identity",
      "semanticDigestSha256": "64f8f3d9b51363e9ae52690e11fc2086cd5d1b751bf3063ff9466bd78d9115e1"
    },
    {
      "instanceId": "function.specialization.52c9e160df4485406da4318aab6efff84f82f8da21218ee749e3123c4932d623",
      "reasons": [
        {
          "callerInstanceId": "function.Main.main",
          "source": {
            "startLine": 70,
            "file": "Main.hx",
            "startColumn": 25,
            "endLine": 70,
            "endColumn": 38
          }
        },
        {
          "callerInstanceId": "function.Main.main",
          "source": {
            "startLine": 89,
            "file": "Main.hx",
            "startColumn": 4,
            "endLine": 89,
            "endColumn": 21
          }
        },
        {
          "callerInstanceId": "function.specialization.7144fbd75777c746113870e78d4be848e3aff7b96f8b315cba222f1c284cc65e",
          "source": {
            "startLine": 40,
            "file": "Main.hx",
            "startColumn": 3,
            "endLine": 40,
            "endColumn": 19
          }
        }
      ],
      "recursive": false,
      "specializationKey": "generic-function-v1(22:function.Main.identity1:3:f64)",
      "arguments": [
        {
          "representation": "direct-primitive",
          "key": "f64",
          "parameter": "T",
          "displayName": "Float"
        }
      ],
      "cName": "hxc_Main_identity_h1296fdd09874",
      "displayName": "identity<Float>",
      "codeSize": {
        "definitionSha256": "4f71d83ed4e1c026b67a4ccb7f5b36cb2fb19ccf0a00318a01447b3bf9ccfe21",
        "definitionBytes": 84,
        "metric": "strict-c11-utf8-function-definition-bytes",
        "irInstructions": 0,
        "irBlocks": 1
      },
      "baseFunctionId": "function.Main.identity",
      "semanticDigestSha256": "52c9e160df4485406da4318aab6efff84f82f8da21218ee749e3123c4932d623"
    },
    {
      "instanceId": "function.specialization.1d01de2b1869a1f2d01c9e11d21e993708ebca0e36dab15736ebcf18314b3f62",
      "reasons": [
        {
          "callerInstanceId": "function.Main.main",
          "source": {
            "startLine": 68,
            "file": "Main.hx",
            "startColumn": 21,
            "endLine": 68,
            "endColumn": 32
          }
        },
        {
          "callerInstanceId": "function.Main.main",
          "source": {
            "startLine": 69,
            "file": "Main.hx",
            "startColumn": 26,
            "endLine": 69,
            "endColumn": 37
          }
        },
        {
          "callerInstanceId": "function.specialization.bb037e38edd8d20445999f7284295e2d8052d82e8b4be7b0e14141054046b2e8",
          "source": {
            "startLine": 45,
            "file": "Main.hx",
            "startColumn": 10,
            "endLine": 45,
            "endColumn": 25
          }
        }
      ],
      "recursive": false,
      "specializationKey": "generic-function-v1(22:function.Main.identity1:3:i32)",
      "arguments": [
        {
          "representation": "direct-primitive",
          "key": "i32",
          "parameter": "T",
          "displayName": "Int"
        }
      ],
      "cName": "hxc_Main_identity_he5684aaf2cae",
      "displayName": "identity<Int>",